{
  "schema": "icefarm-farm-v1",
  "hub": {
    "results_root": "/tanksmall/scratch/ictmp/experiments/icecream/integration"
  },
  "registry": {
    "host": "tt-quietbox3",
    "port": 5000,
    "mode": "save-load"
  },
  "image_transport": {
    "codec": "zstd",
    "level": 19,
    "long": 31,
    "threads": 8,
    "checksum": true
  },
  "netname_prefix": "icefarm",
  "port_range": [23000, 23999],
  "hosts": [
    {
      "name": "tt-quietbox3",
      "ssh": "mickg10@10.0.27.101",
      "docker_context": "q3",
      "lan_ip": "10.0.27.101",
      "arch": "x86_64",
      "cores": 32,
      "mem_gb": 256,
      "scratch_root": "/home/mickg10/farm-scratch",
      "roles_allowed": ["S", "F", "C"],
      "sudo": true,
      "netem": true,
      "shared_lan": "10.0.27.0/24"
    },
    {
      "name": "tt-quietbox2",
      "ssh": "mickg10@100.91.242.69",
      "docker_context": "q2",
      "lan_ip": "10.0.27.212",
      "arch": "x86_64",
      "cores": 32,
      "mem_gb": 256,
      "scratch_root": "/home/mickg10/farm-scratch",
      "roles_allowed": ["F", "C"],
      "sudo": true,
      "netem": false,
      "shared_lan": "10.0.27.0/24"
    },
    {
      "name": "research6",
      "ssh": "mickg@research6",
      "docker_context": "r6",
      "lan_ip": "10.0.27.56",
      "arch": "x86_64",
      "cores": 20,
      "mem_gb": 128,
      "scratch_root": "/home/mickg/farm-scratch",
      "roles_allowed": ["F", "C"],
      "sudo": false,
      "netem": false,
      "shared_lan": "10.0.27.0/24"
    }
  ],
  "corpora": {
    "fmt-100": {
      "kind": "tu-manifest",
      "tus": 50,
      "repeat": 2,
      "manifest": "/tanksmall/scratch/ictmp/corpus7/manifest.txt",
      "manifest_sha256": "c362761c3a7e45af984ffd561c772783ab4f27efda7eb6f24afd84223e8233d0",
      "root": "/tanksmall/scratch/ictmp/corpus7/CMakeFiles",
      "compression": {"codec": "zstd", "level": 19, "long": 31, "threads": 8, "checksum": true},
      "archives": {
        "files": {
          "archive": "/tanksmall/scratch/ictmp/experiments/icecream/integration/corpora/fmt-100-files-zstd19-long31-v1.tar.zst",
          "archive_bytes": 744162,
          "archive_sha256": "522456e2fadbd0262732281e7beb49ad7bc4ef51c55a238295fcb324ef72d971",
          "authority_sha256": "acfaca997e1fc7db4b040d2858ba54dc0c5fc15e433a2762ada0e80ff2ec43d3",
          "files": 50,
          "manifest_sha256": "52d163000a558dad8e9f893809e2b3c3ade347bf6705dee7e61ad78299b8b39d",
          "unpacked_bytes": 136350082
        }
      },
      "compiler_recipes": {
        "debian-gcc": {
          "executable": "/usr/bin/g++",
          "binary_sha256": "dd91977c184e327710578363ad93ebb175c3a457b6236b874fd3911b7c055c65",
          "configuration_sha256": "30d282954b70763ea287fcefdd07dae11ebe12b056d56605f8d59fa732d40991",
          "version": "g++ (Debian 12.2.0-14+deb12u1) 12.2.0",
          "arguments": ["-O2", "-fdiagnostics-color=never"]
        }
      }
    },
    "firefox-1000": {
      "kind": "tu-manifest",
      "tus": 1000,
      "turn_a_manifest": "/tanksmall/scratch/ictmp/experiments/icecream/integration/corpora/firefox-compile-valid-1000-20260905T100313Z/turnA.manifest",
      "turn_b_manifest": "/tanksmall/scratch/ictmp/experiments/icecream/integration/corpora/firefox-compile-valid-1000-20260905T100313Z/turnB.manifest",
      "normalized_manifest_sha256": "4e8ef6e7c4dd70a0f5918f3a6e3e17e20c20f10eeca78f118fd78a965984ccc3",
      "pair_index_sha256": "6c1f69a411c4d3260b43d66060b1f987010a01f2f6887ed073b51e47d6d36619",
      "authority_receipt": {
        "path": "/tanksmall/scratch/ictmp/experiments/icecream/integration/corpora/firefox-compile-valid-1000-20260905T100313Z/authority.json",
        "sha256": "b43b5e72bcc23f744fd881dcc64cd71e7d10721af9e1b32fdcb1764f8fed2f0d"
      },
      "root": "/tanksmall/scratch/ictmp/src3/gecko-dev",
      "compression": {"codec": "zstd", "level": 19, "long": 31, "threads": 8, "checksum": true},
      "archives": {
        "A": {
          "archive": "/tanksmall/scratch/ictmp/experiments/icecream/integration/corpora/firefox-compile-valid-1000-archives-20260905T1025Z/firefox-1000-A-zstd19-long31-v1.tar.zst",
          "archive_bytes": 12537423,
          "archive_sha256": "33316d5cc37f6c6b9414550fc375dab10cc99f59b29506eb7a92e807298a9255",
          "authority_sha256": "ef8f64ac4dd7a0d7468c958bdb7fa0d830ac64b1294acb6e5f06e034d7f02882",
          "files": 1000,
          "manifest_sha256": "f6ed09699d187bf499d6fd28eb5947eba252101877cd88776c61427726f29f3d",
          "unpacked_bytes": 4375268540
        },
        "B": {
          "archive": "/tanksmall/scratch/ictmp/experiments/icecream/integration/corpora/firefox-compile-valid-1000-archives-20260905T1025Z/firefox-1000-B-zstd19-long31-v1.tar.zst",
          "archive_bytes": 12535229,
          "archive_sha256": "5c13b613238c57a90ce213dfae62dc1270c3bdf194e34e026422b7b0359ae429",
          "authority_sha256": "1bd6403b9f5f4553783ad67c028cc46abe34783abd1647fa46d97b21f2415608",
          "files": 1000,
          "manifest_sha256": "9393a5198514464c0171565195f7e416824a40af74f18ff842e2bca423ee415f",
          "unpacked_bytes": 4375269157
        }
      },
      "compiler_recipes": {
        "fedora-clang-libcxx": {
          "executable": "/tanksmall/MICKG2/mickg/miniconda3/envs/clang21/bin/clang++",
          "binary_sha256": "dd5bb93311545d121dae93e31b3958aba449e97415d02c35a3391c0e4662bf93",
          "configuration_sha256": "72e2012f05218d8237ed2a6fe284d873feae7b69b1dfdc0c0b9d56d950a320bb",
          "version": "clang version 21.1.8 (https://github.com/conda-forge/clangdev-feedstock 9a0c00c7abbcade892ea988cb6239816cc91d7fc)",
          "arguments": ["-O2", "-fdiagnostics-color=never"],
          "toolchain": {
            "archive": "/tanksmall/scratch/ictmp/experiments/icecream/integration/toolchains/clang21-conda-21.1.8-full-zstd19-long31-v1.tar.zst",
            "archive_bytes": 264898201,
            "archive_sha256": "f3f93d9b31d3df3f3261063ce9d9a80f1c2d9319904f5bd6f64fca011877cd1b",
            "compression": {"codec": "zstd", "level": 19, "long": 31, "threads": 8, "checksum": true},
            "mount": "/tanksmall/MICKG2/mickg/miniconda3/envs/clang21",
            "unpacked_bytes": 2718868255
          }
        }
      }
    }
  },
  "runtime_image": {
    "reference": "icecream/farm-node:ubuntu22-gcc11-boost174",
    "id": "sha256:fe001a6138f017608b8846b43bf268a76a9d7a5b66c3364ba3f881da2ff0c54b",
    "closure_sha256": "4d7755577d3dba476eae03cb51f278fe87ea10e775f410bdf330227c480d4cab",
    "dockerfile": "farmharness/integration/docker/Dockerfile.node"
  },
  "system_source_snapshots": {
    "stable-f-source": {
      "schema": "icefarm-system-source-snapshot-v1",
      "source": "runtime",
      "source_runtime_reference": "icecream/farm-node:ubuntu22-gcc11-boost174",
      "source_runtime_id": "sha256:fe001a6138f017608b8846b43bf268a76a9d7a5b66c3364ba3f881da2ff0c54b",
      "source_runtime_closure_sha256": "4d7755577d3dba476eae03cb51f278fe87ea10e775f410bdf330227c480d4cab",
      "manifest_sha256": "be0d9026e7fc6235382a628a13f0ecc1f5e9c4f4e0d18eea9ab750df08cdb66c",
      "file_count": 16819,
      "enumeration": {
        "schema": "icefarm-system-source-manifest-v1",
        "roots": ["/usr/include", "/usr/lib/gcc", "/usr/local/include"],
        "symlink_policy": "no-directory-follow;regular-file-symlinks-regularized"
      },
      "archive": {
        "path": "/tanksmall/scratch/tmp/system-source-capture-tAkYk3/archives/system-source-be0d9026e7fc6235382a628a13f0ecc1f5e9c4f4e0d18eea9ab750df08cdb66c.tar.zst",
        "sha256": "ee52009cded8fcbe9ca9490dc50942b00fc43c786f2113001de5f1c62094a5f6",
        "archive_bytes": 42426888,
        "unpacked_bytes": 277530174,
        "compression": {"codec": "zstd", "level": 19, "long": 31, "threads": 8, "checksum": true}
      }
    }
  },
  "client_environments": {
    "conan-gcc": {
      "reference": "ice-ii/conan-gcc:v2-p50",
      "id": "sha256:73c0d2615acbdac51a124ca3a2a80c844e77383e67c497c7c2dd4c04fa74c60c",
      "closure_sha256": "4d726c7c69086eda12d8d26bfbb262521590aa391de9a7f71c1fc99e273cd797",
      "dockerfile": "farmharness/integration/docker/environments/Dockerfile.conan-gcc-p50"
    },
    "debian-gcc": {
      "reference": "ice-ii/debian-gcc:v2-p50",
      "id": "sha256:bf56e3397c20fc68260df088edaeaf9974c08bea93c2a1f48d266736663607e2",
      "closure_sha256": "87a5cfd71a4e14fffcf3ff360252cb72c4935ce406659e7e1df68ebdea800fd2",
      "dockerfile": "farmharness/integration/docker/environments/Dockerfile.debian-gcc-p50"
    },
    "fedora-clang-libcxx": {
      "reference": "ice-ii/fedora-clang-libcxx:v2-p50",
      "id": "sha256:eb4a1219832900a5b9d7e5189dbfa277699550906c6b70b26020c7dbfabf5f96",
      "closure_sha256": "abb21108e4ef9fc9ee6251d4f1eff6ffa04d7240f7e5a5a56eb464664bd01da5",
      "dockerfile": "farmharness/integration/docker/environments/Dockerfile.fedora-clang-libcxx-p50"
    },
    "linuxbrew": {
      "reference": "ice-ii/linuxbrew:v2-p50",
      "id": "sha256:372ce4991b5f35082fff0fbfe7711718572410120a2d35adf91248092399c84d",
      "closure_sha256": "c678308d5674fbab9efbd23e8280b82c8f1e48534a5b912e370ece00f213f41a",
      "dockerfile": "farmharness/integration/docker/environments/Dockerfile.linuxbrew-p50"
    }
  },
  "protected": {
    "process_patterns": ["bigfarm"],
    "never_touch_labels_other_than": "icefarm.*"
  },
  "authority": {
    "schema": "icecream-newgen-farm-authority-v1",
    "hosts": {
      "tt-quietbox3": {"class": "submission", "address": "10.0.27.101"},
      "tt-quietbox2": {"class": "worker", "address": "10.0.27.212"},
      "research6": {"class": "orchestration", "address": "10.0.27.56"}
    },
    "role_stores": {
      "43": {
        "scheduler": {"sha256": "5e85c16a12e33cc27900dab351a997fa49f801b89612272ffae9710e26372fb7"},
        "client": {"sha256": "02b66cc29cd9431b410b443e1f5c1650d93f9ac7407e52cdd399c7c4e5bd34b3"},